<!DOCTYPE routine SYSTEM "routine.dtd">
<routine>
    <summary>Du findest ein mysteriöses Logbuch in deinem Spind</summary>
    <sound src="bg.mp3" />

    <imports>
        <import src="e1.xml" />
    </imports>

    <characters>
        <character id="max" name="Max" summary="Demo Charakter" presentedIn="2" />
    </characters>

    <frames>
        <frame id="0" author="Jakob">
            <title>A666</title>
            <text>
                Title screen
            </text>
            <image src="0.png" />
            <options>
                <option to="1" style="greyed shining shaking" default="default">Start</option>
            </options>
        </frame>
        <frame id="1" flag="test">
            <title>The Beginning<if flag="test"> – I've Played These Games Before!!1!</if></title>
            <text>
                Once upon a time, in a land far away, <cr id="max" /> ...
            </text>
            <image src="1.png" />
            <sound src="1.mp3" />
            <options>
                <option to="2">Weiter</option>
            </options>
        </frame>
    </frames>
</routine>